"title","authors","venue","publishing_date","url","date_found","source_mode","relevance_tier","theme_group","headline","summary","abstract","notes"
"SLowRL: Safe Low-Rank Adaptation Reinforcement Learning for Locomotion","not specified","arXiv:2603.17092","Mar 2026","https://arxiv.org/abs/2603.17092","2026-03-24","web_survey","probably","Verification & Safety","LoRA fine-tuning of RL policies with recovery guarantees if safety is violated","Safe fine-tuning of RL locomotion policies using Low-Rank Adaptation with recovery policy enforcement.","Sim-to-real transfer of locomotion policies often leads to performance degradation due to the inevitable sim-to-real gap. Naively fine-tuning these policies directly on hardware is problematic, as it poses risks of mechanical failure and suffers from high sample inefficiency. The paper addresses the challenge of safely and efficiently fine-tuning reinforcement learning (RL) policies for dynamic locomotion tasks, specifically focusing on fine-tuning policies learned in simulation directly on hardware, while explicitly enforcing safety constraints. The authors introduce SLowRL, a framework that combines Low-Rank Adaptation (LoRA) with training-time safety enforcement via a recovery policy. The method is evaluated both in simulation and on a real Unitree Go2 quadruped robot for jump and trot tasks. Experimental results show that the method achieves a 46.5% reduction in fine-tuning time and near-zero safety violations compared to standard proximal policy optimization (PPO) baselines.",""
"Conformal Signal Temporal Logic for Robust Reinforcement Learning Control","not specified","ICASSP 2026","Feb 2026","https://arxiv.org/abs/2602.14322","2026-03-24","web_survey","definitely","Conformal Prediction","Conformal STL monitoring + runtime shield for safe flight control","Safe RL integrating conformal STL monitoring with runtime shield for flight control.","The paper investigates how formal temporal logic specifications can enhance the safety and robustness of reinforcement learning (RL) control in aerospace applications. Using the open source AeroBench F-16 simulation benchmark, the authors train a Proximal Policy Optimization (PPO) agent to regulate engine throttle and track commanded airspeed. The control objective is encoded as a Signal Temporal Logic (STL) requirement to maintain airspeed within a prescribed band during the final seconds of each maneuver. To enforce this specification at run time, they introduce a conformal STL shield that filters the RL agent's actions using online conformal prediction. Experiments show that the conformal shield preserves STL satisfaction while maintaining near baseline performance and providing stronger robustness guarantees than the classical shield, demonstrating that combining formal specification monitoring with data driven RL control can substantially improve the reliability of autonomous flight control in challenging environments.",""
"Bridging Conformal Prediction and Scenario Optimization: Discarded Constraints and Modular Risk Allocation","not specified","arXiv:2603.19396","Mar 2026","https://arxiv.org/abs/2603.19396","2026-03-24","web_survey","definitely","Conformal Prediction","Unified framework connects conformal prediction with scenario optimization","Connects scenario optimization and conformal prediction for multi-output prediction and finite-horizon control.","Scenario optimization and conformal prediction share a common goal, that is, turning finite samples into safety margins. Yet, different terminology often obscures the connection between their respective guarantees. The paper revisits that connection directly from a systems-and-control viewpoint. Building on recent work, the authors extend the forward direction to feasible sample-and-discard scenario algorithms, showing that if the final decision is determined by a stable subset of the retained sampled constraints, the classical mean violation law admits a direct exchangeability-based derivation.",""
"Learnable Conformal Prediction with Context-Aware Nonconformity Functions for Robotic Planning and Perception","not specified","arXiv:2509.21955","Sep 2025","https://arxiv.org/abs/2509.21955","2026-03-24","web_survey","definitely","Conformal Prediction","Learned nonconformity scores improve CP for robot navigation (91.5% success)","LCP framework learning context-aware nonconformity while preserving conformal guarantees; 91.5% navigation success.","Deep learning models in robotics often output point estimates with poorly calibrated confidences, offering no native mechanism to quantify predictive reliability under novel, noisy, or out-of-distribution inputs. Conformal prediction (CP) addresses this gap by providing distribution-free coverage guarantees, yet its reliance on fixed nonconformity scores ignores context and can yield intervals that are overly conservative or unsafe. The paper addresses this with Learnable Conformal Prediction (LCP), which replaces fixed scores with a lightweight neural function that leverages geometric, semantic, and task-specific features to produce context-aware uncertainty sets.",""
"Sample-Efficient Expert Query Control in Active Imitation Learning via Conformal Prediction","not specified","arXiv:2512.00453","Dec 2025","https://arxiv.org/abs/2512.00453","2026-03-24","web_survey","definitely","Conformal Prediction","Conformal prediction decides when to query the expert in active IL","CRSAIL uses conformal prediction for expert querying thresholds in active imitation learning.","Active imitation learning (AIL) combats covariate shift by querying an expert during training, but expert action labeling often dominates the cost, especially in GPU-intensive simulators, human-in-the-loop settings, and robot fleets that revisit near-duplicate states. This paper presents Conformalized Rejection Sampling for Active Imitation Learning (CRSAIL), a querying rule that requests an expert action only when the visited state is under-represented in the expert-labeled dataset. CRSAIL scores state novelty by the distance to the K-th nearest expert state and sets a single global threshold via conformal prediction, where the threshold is the empirical (1-α) quantile of on-policy calibration scores, providing a distribution-free calibration rule that links α to the expected query rate and makes α a task-agnostic tuning knob. Experiments on Inverted Double Pendulum and Pusher demonstrate that CRSAIL is significantly more query efficient than state-of-the-art baselines, while maintaining expert-like performance.","Combines CP + active learning + IL"
"Interaction-aware Conformal Prediction for Crowd Navigation","not specified","arXiv:2502.06221","Feb 2025","https://arxiv.org/abs/2502.06221","2026-03-24","web_survey","definitely","Conformal Prediction","CP models human interaction uncertainty for safe crowd navigation","Interaction-aware motion planning with conformal prediction for human uncertainty in crowd navigation.","During crowd navigation, robot motion plan needs to consider human motion uncertainty, and the human motion uncertainty is dependent on the robot motion plan. This paper introduces Interaction-aware Conformal Prediction (ICP) to alternate uncertainty-aware robot motion planning and decision-dependent human motion uncertainty quantification. ICP is composed of a trajectory predictor to predict human trajectories, a model predictive controller to plan robot motion with confidence interval radii added for probabilistic safety, a human simulator to collect human trajectory calibration dataset conditioned on the planned robot motion, and a conformal prediction module to quantify trajectory prediction error on the decision-dependent calibration dataset. Crowd navigation simulation experiments show that ICP strikes a good balance of performance among navigation efficiency, social awareness, and uncertainty quantification compared to previous works. ICP generalizes well to navigation tasks under various crowd densities, and the fast runtime and efficient memory usage make ICP practical for real-world applications.",""
"Formation-Aware Adaptive Conformalized Perception for Safe Multi-Robot Systems","not specified","arXiv:2603.08958","Mar 2026","https://arxiv.org/abs/2603.08958","2026-03-24","web_survey","definitely","Conformal Prediction","Formation-conditioned conformal sets for multi-robot perception","Risk-Aware Mondrian conformal prediction for formation-conditioned uncertainty in multi-robot systems.","This paper considers the perception safety problem in distributed vision-based leader-follower formations, where each robot uses onboard perception to estimate relative states, track desired setpoints, and keep the leader within its camera field of view (FOV). Safety is challenging due to heteroscedastic perception errors and the coupling between formation maneuvers and visibility constraints. The authors propose a distributed, formation-aware adaptive conformal prediction method based on Risk-Aware Mondrian CP to produce formation-conditioned uncertainty quantiles. The resulting bounds tighten in high-risk configurations (near FOV limits) and relax in safer regions. They integrate these bounds into a Formation-Aware Conformal CBF-QP with a smooth margin to enforce visibility while maintaining feasibility and tracking performance. Gazebo simulations show improved formation success rates and tracking accuracy over non-adaptive (global) CP baselines that ignore formation-dependent visibility risk, while preserving finite-sample probabilistic safety guarantees.",""
"When Environments Shift: Safe Planning with Generative Priors and Robust Conformal Prediction","not specified","arXiv:2602.12616","Feb 2026","https://arxiv.org/abs/2602.12616","2026-03-24","web_survey","definitely","Conformal Prediction","Robust CP + generative priors enable safe planning under distribution shift","Combines generative models and robust conformal prediction for safe planning under distribution shift.","Autonomous systems operate in environments that may change over time. An example is the control of a self-driving vehicle among pedestrians and human-controlled vehicles whose behavior may change based on factors such as traffic density, road visibility, and social norms. Therefore, the environment encountered during deployment rarely mirrors the environment and data encountered during training -- a phenomenon known as distribution shift -- which can undermine the safety of autonomous systems. This paper proposes a planning framework that maintains probabilistic safety guarantees for autonomous systems under distribution shifts by using robust conformal prediction along with data generated by conditional diffusion models which capture the natural variations in the test-time environment. The underlying assumption is that the distribution of the environment is parameterized by a nuisance parameter (an observable, interpretable quantity such as traffic density or road visibility). The authors utilize a model of natural variation that generates inexpensive synthetic data approximating the deployment-time distribution, enabling the construction of prediction regions that extend standard conformal prediction guarantees to shifted environments and facilitates safe motion planning. Empirical evaluations in the ORCA simulator demonstrate that their planning method achieves reliable coverage and safety across both seen and unseen environments.",""
"Safe Planning in Unknown Environments using Conformalized Semantic Maps","not specified","arXiv:2509.25124","Sep 2025","https://arxiv.org/abs/2509.25124","2026-03-24","web_survey","definitely","Conformal Prediction","Conformalized semantic maps provide probabilistic safety for planning","Conformal prediction generating map sets containing ground-truth with user-defined probability.","This paper addresses semantic planning problems in unknown environments under perceptual uncertainty. The environment contains multiple unknown semantically labeled regions or objects, and the robot must reach desired locations while maintaining class-dependent distances from them. The authors aim to compute robot paths that complete such semantic reach-avoid tasks with user-defined probability despite uncertain perception. Existing planning algorithms either ignore perceptual uncertainty - thus lacking correctness guarantees - or assume known sensor models and noise characteristics. In contrast, the paper presents the first planner for semantic reach-avoid tasks that achieves user-specified mission completion rates without requiring any knowledge of sensor models or noise, enabled by quantifying uncertainty in semantic maps using conformal prediction in a model- and distribution-free manner.",""
"Learning Robot Safety from Sparse Human Feedback using Conformal Prediction","not specified","arXiv:2501.04823","Jan 2025","https://arxiv.org/abs/2501.04823","2026-03-24","web_survey","definitely","Conformal Prediction","Sparse human feedback + CP learns safety constraints efficiently","Uses conformal prediction to learn safety constraints from sparse human feedback.","Ensuring robot safety can be challenging as user-defined constraints can miss edge cases, policies can become unsafe even when trained from safe data, and safety can be subjective. The paper learns about robot safety by showing policy trajectories to a human who flags unsafe behavior, then uses conformal prediction to identify a region of states guaranteed to contain a user-specified fraction of future policy errors. The method is sample-efficient, as it builds on nearest neighbor classification and avoids withholding data as is common with conformal prediction. By alerting if the robot reaches the suspected unsafe region, the approach obtains a warning system that mimics the human's safety preferences with guaranteed miss rate. From video labeling, the system can detect when a quadcopter visuomotor policy will fail to steer through a designated gate.",""
"Anytime-Valid Conformal Risk Control","not specified","arXiv:2602.04364","Feb 2026","https://arxiv.org/abs/2602.04364","2026-03-24","web_survey","probably","Conformal Prediction","Anytime-valid guarantees extend conformal risk control to sequential settings","Framework for distribution-free risk control with anytime-valid guarantees.","Prediction sets provide a means of quantifying the uncertainty in predictive tasks. Using held out calibration data, conformal prediction and risk control can produce prediction sets that exhibit statistically valid error control in a computationally efficient manner. However, in the standard formulations, the error is only controlled on average over many possible calibration datasets of fixed size. This paper extends the control to remain valid with high probability over a cumulatively growing calibration dataset at any time point. The guarantees are derived using quantile-based arguments and illustrate the applicability of the proposed framework to settings involving distribution shift. The authors further establish a matching lower bound and show that their guarantees are asymptotically tight.","General CP theory, relevant to methods"
"Statistical-Symbolic Verification of Autonomous Systems using State-Dependent Conformal Prediction","not specified","arXiv:2512.02893","Dec 2025","https://arxiv.org/abs/2512.02893","2026-03-24","web_survey","definitely","Conformal Prediction","State-dependent CP enables statistical verification of perception systems","State-dependent conformal prediction for verifying perception-based autonomous systems.","Reachability analysis has been a prominent way to provide safety guarantees for neurally controlled autonomous systems, but its direct application to neural perception components is infeasible due to imperfect or intractable perception models. Typically, this issue has been bypassed by complementing reachability with statistical analysis of perception error, say with conformal prediction (CP). However, existing CP methods for time-series data often provide conservative bounds. The corresponding error accumulation over time has made it challenging to combine statistical bounds with symbolic reachability in a way that is provable, scalable, and minimally conservative. To reduce conservatism and improve scalability, the key insight is that perception error varies significantly with the system's dynamical state. The paper proposes state-dependent conformal prediction, which exploits that dependency in constructing tight high-confidence bounds on perception error. Based on this idea, the authors provide an approach to partition the state space, using a genetic algorithm, so as to optimize the tightness of conformal bounds. Since using these bounds in reachability analysis leads to additional uncertainty and branching in the resulting hybrid system, they propose a branch-merging reachability algorithm that trades off uncertainty for scalability so as to enable scalable and tight verification. The evaluation of their verification methodology on two complementary case studies demonstrates reduced conservatism compared to the state of the art.","Core: verification + CP"
"SeedPolicy: Horizon Scaling via Self-Evolving Diffusion Policy for Robot Manipulation","not specified","arXiv:2603.05117","Mar 2026","https://arxiv.org/abs/2603.05117","2026-03-24","web_survey","definitely","Diffusion/Flow Matching Policies","Self-evolving attention scales diffusion policy horizons by 36.8%","Self-Evolving Gated Attention for scalable horizon extension; 36.8% improvement over standard Diffusion Policy.","Imitation Learning (IL) enables robots to acquire manipulation skills from expert demonstrations. Diffusion Policy (DP) models multi-modal expert behaviors but suffers performance degradation as observation horizons increase, limiting long-horizon manipulation. The authors propose Self-Evolving Gated Attention (SEGA), a temporal module that maintains a time-evolving latent state via gated attention, enabling efficient recurrent updates that compress long-horizon observations into a fixed-size representation while filtering irrelevant temporal information. Integrating SEGA into DP yields Self-Evolving Diffusion Policy (SeedPolicy), which resolves the temporal modeling bottleneck and enables scalable horizon extension with moderate overhead. On the RoboTwin 2.0 benchmark with 50 manipulation tasks, SeedPolicy outperforms DP and other IL baselines. Averaged across both CNN and Transformer backbones, SeedPolicy achieves 36.8% relative improvement in clean settings and 169% relative improvement in randomized challenging settings over the DP. Compared to vision-language-action models such as RDT with 1.2B parameters, SeedPolicy achieves competitive performance with one to two orders of magnitude fewer parameters, demonstrating strong efficiency and scalability.",""
"Learning Diffusion Policy from Primitive Skills for Robot Manipulation","not specified","arXiv:2601.01948","Jan 2026","https://arxiv.org/abs/2601.01948","2026-03-24","web_survey","definitely","Diffusion/Flow Matching Policies","Skill-conditioned diffusion policy decomposes manipulation into interpretable primitives","Skill-conditioned Diffusion Policy integrating interpretable skill learning with conditional action planning.","Diffusion policies have recently shown great promise for generating actions in robotic manipulation, though existing approaches often rely on global instructions to produce short-term control signals, which can result in misalignment in action generation. The authors conjecture that primitive skills—referred to as fine-grained, short-horizon manipulations, such as ""move up"" and ""open the gripper""—provide a more intuitive and effective interface for robot learning. To bridge this gap, they propose SDP, a skill-conditioned diffusion policy that integrates interpretable skill learning with conditional action planning. SDP abstracts eight reusable primitive skills across tasks and employs a vision-language model to extract discrete representations from visual observations and language instructions, with a lightweight router network designed to assign a desired primitive skill for each state, which helps construct a single-skill policy to generate skill-aligned actions.","Also relevant to controller composition"
"Flow Policy Gradients for Robot Control","not specified","arXiv:2602.02481","Feb 2026","https://arxiv.org/abs/2602.02481","2026-03-24","web_survey","definitely","Diffusion/Flow Matching Policies","Flow matching gradients unify locomotion, manipulation, and sim-to-real","Flow matching policy gradients for legged locomotion, humanoid tracking, manipulation, and sim-to-real.","Likelihood-based policy gradient methods are the dominant approach for training robot control policies from rewards. These methods rely on differentiable action likelihoods, which constrain policy outputs to simple distributions like Gaussians. In this work, the authors show how flow matching policy gradients -- a recent framework that bypasses likelihood computation -- can be made effective for training and fine-tuning more expressive policies in challenging robot control settings. The work introduces an improved objective that enables success in legged locomotion, humanoid motion tracking, and manipulation tasks, as well as robust sim-to-real transfer on two humanoid robots. The paper then presents ablations and analysis on training dynamics.",""
"You've Got a Golden Ticket: Improving Generative Robot Policies With A Single Noise Vector","not specified","arXiv:2603.15757","Mar 2026","https://arxiv.org/abs/2603.15757","2026-03-24","web_survey","probably","Diffusion/Flow Matching Policies","Single well-chosen noise vector boosts flow matching policy performance","Improves flow matching policy performance using well-chosen constant initial noise.","This paper addresses the question: ""What happens when a pretrained generative robot policy is provided a constant initial noise as input, rather than repeatedly sampling it from a Gaussian?"" The authors demonstrate that the performance of a pretrained, frozen diffusion or flow matching policy can be improved with respect to a downstream reward by swapping the sampling of initial noise from the prior distribution (typically isotropic Gaussian) with a well-chosen, constant initial noise input—a golden ticket. The authors propose a search method to find golden tickets using Monte-Carlo policy evaluation that keeps the pretrained policy frozen, does not train any new networks, and is applicable to all diffusion/flow matching policies (and therefore many VLAs). Their approach to policy improvement makes no assumptions beyond being able to inject initial noise into the policy and calculate (sparse) task rewards of episode rollouts, making it deployable with no additional infrastructure or models.",""
"Generative Predictive Control: Flow Matching Policies for Dynamic Tasks","not specified","arXiv:2502.13406","Feb 2025","https://arxiv.org/abs/2502.13406","2026-03-24","web_survey","definitely","Diffusion/Flow Matching Policies","Flow matching policies handle fast dynamics with warm-start inference","Supervised learning framework for fast-dynamics tasks using flow-matching policies with warm-start inference.","Generative control policies have recently unlocked major progress in robotics. These methods produce action sequences via diffusion or flow matching, with training data provided by demonstrations. However, existing methods come with two key limitations: they require expert demonstrations, which can be difficult to obtain, and they are limited to relatively slow, quasi-static tasks. The authors leverage a tight connection between sampling-based predictive control and generative modeling to address each of these issues. In particular, they introduce generative predictive control, a supervised learning framework for tasks with fast dynamics that are easy to simulate but difficult to demonstrate. They then show how trained flow-matching policies can be warm-started at inference time, maintaining temporal consistency and enabling high-frequency feedback. The authors believe that generative predictive control offers a complementary approach to existing behavior cloning methods, and hope that it paves the way toward generalist policies that extend beyond quasi-static demonstration-oriented tasks.",""
"Abstracting Robot Manipulation Skills via Mixture-of-Experts Diffusion Policies","not specified","arXiv:2601.21251","Jan 2026","https://arxiv.org/abs/2601.21251","2026-03-24","web_survey","definitely","Diffusion/Flow Matching Policies","MoE diffusion learns compact skill basis with lower inference cost","MoE diffusion learns compact orthogonal skill basis with higher success rates and lower inference cost.","Diffusion-based policies have recently shown strong results in robot manipulation, but their extension to multi-task scenarios is hindered by the high cost of scaling model size and demonstrations. The paper introduces Skill Mixture-of-Experts Policy (SMP), a diffusion-based mixture-of-experts policy that learns a compact orthogonal skill basis and uses sticky routing to compose actions from a small, task-relevant subset of experts at each step. A variational training objective supports this design, and adaptive expert activation at inference yields fast sampling without oversized backbones. The authors validate SMP in simulation and on a real dual-arm platform with multi-task learning and transfer learning tasks, where SMP achieves higher success rates and markedly lower inference cost than large diffusion baselines.","Also relevant to controller composition"
