"title","authors","venue","publishing_date","url","date_found","source_mode","relevance_tier","theme_group","headline","summary","abstract","notes"
"Generalizations of Backup Control Barrier Functions: Safety of Compositions and Dynamically Defined Sets","D van Wijk, K Garg, R Bajcsy","arXiv:2603.18450","Mar 2026","https://arxiv.org/abs/2603.18450","2026-03-24","email","definitely","Safety & Verification","Backup CBFs extended to handle composed safe sets and dynamic constraints","Extends backup CBFs to compositions of safe sets and dynamically defined sets.","Guaranteeing the safety of nonlinear systems with bounded inputs remains a key challenge in safe autonomy. Backup control barrier functions (bCBFs) provide a powerful mechanism for constructing controlled invariant sets by propagating trajectories under a pre-verified backup controller to a forward invariant backup set. While the standard bCBF method utilizes the same backup controller for both set expansion and safety certification, which can restrict the expanded safe set and lead to conservative dynamic behavior, this study generalizes the bCBF framework by separating the set-expanding controller from the verified backup controller, thereby enabling a broader class of expansion strategies while preserving formal safety guarantees. The authors establish sufficient conditions for forward invariance of the resulting implicit safe set and show how the generalized construction recovers existing bCBF methods as special cases.","Alert: Lindemann/Bansal/Tomlin/Bajcsy. Core - extends backup CBF theory"
"Safety Guarantees for Neural Network-Encoded Control Policies via CBF Verification","not specified","arXiv preprint","Nov 2025","https://arxiv.org/abs/2511.06341","2026-03-24","email","definitely","Safety & Verification","CBF-based framework can now verify safety of neural network controllers","Verifies safety of NN control policies using CBFs. Directly relevant to black-box controller verification.","Control barrier functions (CBFs) are a popular tool for safety certification of nonlinear dynamical control systems. Recently, CBFs represented as neural networks have shown great promise due to their expressiveness and applicability to a broad class of dynamics and safety constraints. However, verifying that a trained neural network is indeed a valid CBF is a computational bottleneck that limits the size of the networks that can be used. To overcome this limitation, the authors present a novel framework for verifying neural CBFs based on piecewise linear upper and lower bounds on the conditions required for a neural network to be a CBF. Their approach is rooted in linear bound propagation (LBP) for neural networks, which they extend to compute bounds on the gradients of the network. Combined with McCormick relaxation, they derive linear upper and lower bounds on the CBF conditions, thereby eliminating the need for computationally expensive verification procedures.","Alert: Tomlin. Core - NN policy verification via CBFs"
"Data-Driven Abstractions for Verification with Conformal Guarantees","not specified","arXiv preprint","Jan 2026","https://arxiv.org/abs/2601.01076","2026-03-24","email","definitely","Conformal Prediction / Verification","Conformal prediction meets data-driven verification for formal safety proofs","Data-driven abstractions for verification using conformal prediction guarantees.","The paper proposes a scalable reachability-based framework for probabilistic, data-driven safety verification of unknown nonlinear dynamics. It uses Koopman theory with a neural network lifting function to learn an approximate linear representation of the dynamics and design linear controllers in this space to enable closed-loop tracking of a reference trajectory distribution. Closed-loop reachable sets are efficiently computed in the lifted space and mapped back to the original state space via NN verification tools. To capture model mismatch between the Koopman dynamics and the true system, conformal prediction is applied to produce statistically-valid error bounds that inflate the reachable sets to ensure the true trajectories are contained with a user-specified probability.","Alert: Lindemann citation. Core - data-driven verification + conformal prediction"
"Adversarial Robustness for Matrix Control Barrier Functions","W Cosner, AD Ames","arXiv preprint","Mar 2026","https://arxiv.org/abs/2603.18307","2026-03-24","email","definitely","Safety & Verification","Matrix CBF safety guarantees hold up under adversarial perturbations","Studies adversarial robustness of matrix CBFs for safety guarantees under perturbations.","This paper presents novel theoretical results to guarantee multi-agent set invariance using Matrix Control Barrier Functions in sampled-data systems. It presents conditions under which heterogeneous control-affine agents applying zero-order-hold control inputs can compute control inputs to render safe sets defined by matrix inequalities forward invariant. It then introduces methods to guarantee set invariance while accounting for the presence of adversarial agents seeking to drive the system state to unsafe sets. Finally, the paper presents theoretical extensions of these set invariance results to systems having high relative degree with respect to the matrix-valued safe set function.","Alert: Lindemann/Tomlin/Bajcsy. Core - robustness analysis for matrix CBFs"
"Dynamical Properties of Safety Filters for Linear Systems and Affine CBFs","P Mestres, SS Mousavi, AD Ames","arXiv:2603.17401","Mar 2026","https://arxiv.org/abs/2603.17401","2026-03-24","email","definitely","Safety & Verification","CBF safety filters can introduce spurious equilibria and stability issues","Analyzes stability, boundedness, spurious equilibria of CBF-based safety filters.","This paper focuses on safety filters designed based on Control Barrier Functions (CBFs): these are modifications of a nominal stabilizing controller typically utilized in safety-critical control applications to render a given subset of states forward invariant. The paper investigates the dynamical properties of the closed-loop systems, with a focus on characterizing undesirable behaviors that may emerge due to the use of CBF-based filters. These undesirable behaviors include unbounded trajectories, limit cycles, and undesired equilibria, which can be locally stable and even form a continuum. The analysis offers the following contributions: (i) conditions under which trajectories remain bounded and (ii) conditions under which limit cycles do not exist; (iii) undesired equilibria can be characterized by solving an algebraic equation, and (iv) asymptotically stable undesired equilibria can exist for a large class of nominal controllers and design parameters of the safety filter (even for convex safe sets). Further, for the specific class of planar systems, explicit formulas are provided for the total number of undesired equilibria and the proportion of saddle points and asymptotically stable equilibria, and in the case of linear planar systems, an exhaustive analysis of their global stability properties is presented.","Alert: Lindemann/Bansal/Tomlin/Herbert. Core - stability/boundedness of CBF safety filters"
"Safety-Guaranteed Imitation Learning from NMPC Experts","not specified","arXiv preprint","Mar 2026","https://arxiv.org/abs/2603.18910","2026-03-24","email","definitely","Safety & Imitation Learning","Policies cloned from NMPC experts now come with formal safety certificates","Safety guarantees for policies learned via imitation from NMPC experts.","This paper presents a safety-guaranteed, runtime-efficient imitation learning framework for spacecraft close proximity control. The work leverages Control Barrier Functions (CBFs) for safety certificates and Control Lyapunov Functions (CLFs) for stability as unified design principles across data generation, training, and deployment. A nonlinear Model Predictive Control (NMPC) expert enforces CBF constraints to provide safe reference trajectories, a neural policy is trained with a novel CBF-CLF-informed loss, and at deployment a lightweight one-step CBF-CLF quadratic program minimally adjusts the learned control input to satisfy hard safety constraints while encouraging stability.","Alert: Tomlin. Core - safety guarantees for IL"
"Exact-Time Safety Recovery using Time-Varying CBFs","K Garg, JW Usevitch","arXiv preprint","Mar 2026","https://arxiv.org/abs/2603.19119","2026-03-24","email","definitely","Safety & Verification","Time-varying CBFs guarantee exact recovery timing after safety violations","Time-varying CBFs that guarantee exact-time recovery to safe sets.","This paper is motivated by controllers developed for autonomous vehicles which occasionally result into conditions where safety is no longer guaranteed. The authors develop an exact-time safety recovery framework for any control-affine nonlinear system when its state is outside a safe region using time-varying Control Barrier Functions (CBFs) with optimal barrier tracking. Unlike conventional formulations that provide only conservative upper bounds on recovery time convergence, the proposed approach guarantees recovery to the safe set at a prescribed time. The key mechanism is an active barrier tracking condition that forces the barrier function to follow exactly a designer-specified recovery trajectory. This transforms safety recovery into a trajectory design problem.","Alert: Lindemann/Tomlin. Core - time-varying CBFs for safety recovery"
"Conformal Prediction for Robot Actions Under Temporal Logic Constraints","not specified","arXiv preprint","Feb 2026","https://arxiv.org/abs/2602.14322","2026-03-24","email","definitely","Conformal Prediction","Robots get distribution-free guarantees on actions under temporal logic specs","Applies conformal prediction to robot actions with temporal logic constraints.","The paper investigates how formal temporal logic specifications can enhance the safety and robustness of reinforcement learning control in aerospace applications. Using the AeroBench F-16 simulation benchmark, the researchers train a Proximal Policy Optimization agent to regulate engine throttle and track commanded airspeed. The control objective is encoded as a Signal Temporal Logic requirement to maintain airspeed within a prescribed band, and a conformal STL shield filters the RL agent's actions using online conformal prediction. The study compares three settings: PPO baseline, PPO with a classical rule-based STL shield, and PPO with the proposed conformal shield, under both nominal conditions and a severe stress scenario involving aerodynamic model mismatch, actuator rate limits, measurement noise, and mid-episode setpoint jumps.","Alert: Lindemann citation. Core - CP + temporal logic for robots"
"Specification-Aware Distribution Shaping for Robotics Foundation Models","not specified","arXiv preprint","Mar 2026","https://arxiv.org/abs/2603.17969","2026-03-24","email","definitely","Safety & Verification","Foundation model outputs can be shaped to satisfy formal specifications","Shapes robotics foundation model outputs to satisfy formal specifications.","Robotics foundation models have demonstrated strong capabilities in executing natural language instructions across diverse tasks and environments. However, they remain largely data-driven and lack formal guarantees on safety and satisfaction of time-dependent specifications during deployment. In practice, robots often need to comply with operational constraints involving rich spatio-temporal requirements such as time-bounded goal visits, sequential objectives, and persistent safety conditions. The paper proposes a specification-aware action distribution optimization framework that enforces a broad class of Signal Temporal Logic (STL) constraints during execution of a pretrained robotics foundation model without modifying its parameters. At each decision step, the method computes a minimally modified action distribution that satisfies a hard STL feasibility constraint by reasoning over the remaining horizon using forward dynamics propagation.","Alert: Lindemann. Core - spec-satisfying foundation models"
"Shifting Uncertainty to Critical Moments: UQ for VLA Models","not specified","arXiv preprint","Mar 2026","https://arxiv.org/abs/2603.18342","2026-03-24","email","definitely","Conformal Prediction / Uncertainty","VLA models focus uncertainty estimates where decisions matter most","Uncertainty quantification for VLA models at critical decision moments.","Vision-Language-Action (VLA) models enable general-purpose robotic policies by mapping visual observations and language instructions to low-level actions, but they often lack reliable introspection. A common practice is to compute a token-level uncertainty signal and take its mean over a rollout. However, mean aggregation can dilute short-lived but safety-critical uncertainty spikes in continuous control. Successful rollouts may contain localized high-entropy segments due to benign noise or non-critical micro-adjustments, while failure rollouts can appear low-entropy for most timesteps and only exhibit brief spikes near the onset of failure. The paper proposes a unified uncertainty quantification approach for predicting rollout success versus failure that uses max-based sliding window pooling to preserve transient risk signals, applies motion-aware stability weighting to emphasize high-frequency action oscillations associated with unstable behaviors.","Alert: Majumdar. Core - UQ for VLA models"
"FlowCorrect: Flow Matching Policy Correction via Online RL","not specified","arXiv preprint","May 2025","https://arxiv.org/abs/2505.22094","2026-03-24","email","definitely","Flow Matching / RL","Online RL patches flow matching policies without retraining from scratch","Corrects flow matching policies using online RL. Combines two key method interests.","ReinFlow is a simple yet effective online reinforcement learning (RL) framework that fine-tunes a family of flow matching policies for continuous robotic control. Derived from rigorous RL theory, ReinFlow injects learnable noise into a flow policy's deterministic path, converting the flow into a discrete-time Markov Process for exact and straightforward likelihood computation. This conversion facilitates exploration and ensures training stability, enabling ReinFlow to fine-tune diverse flow model variants, including Rectified Flow and Shortcut Models, particularly at very few or even one denoising step. The paper benchmarks ReinFlow in representative locomotion and manipulation tasks, including long-horizon planning with visual input and sparse reward.","Alert: Majumdar. High - flow matching + online RL"
"Diffusion Policy Attacker: Adversarial Attacks for Diffusion-based Policies","not specified","arXiv preprint","May 2024","https://arxiv.org/abs/2405.19424","2026-03-24","email","definitely","Diffusion Models / Safety","Adversarial attacks expose vulnerabilities in diffusion-based robot policies","Adversarial attacks on diffusion-based robot policies. Relevant to robustness and diffusion.","Diffusion models (DMs) have emerged as a promising approach for behavior cloning (BC). Diffusion policies (DP) based on DMs have elevated BC performance to new heights, demonstrating robust efficacy across diverse tasks, coupled with their inherent flexibility and ease of implementation. Despite the increasing adoption of DP as a foundation for policy generation, the critical issue of safety remains largely unexplored. While previous attempts have targeted deep policy networks, DP used diffusion models as the policy network, making it ineffective to be attacked using previous methods because of its chained structure and randomness injected. In this paper, the authors undertake a comprehensive examination of DP safety concerns by introducing adversarial scenarios, encompassing offline and online attacks, and global and patch-based attacks. They propose DP-Attacker, a suite of algorithms that can craft effective adversarial attacks across all aforementioned scenarios.","Alert: Bajcsy. High - adversarial attacks on diffusion policies"
"Shielded RL Under Dynamic Temporal Logic Specifications","not specified","arXiv preprint","Mar 2026","https://arxiv.org/abs/2603.17152","2026-03-24","email","definitely","Safe RL","Runtime shields enforce dynamic temporal logic during RL execution","Shielding with RL under dynamic temporal logic specs.","Reinforcement Learning (RL) has shown promise in various robotics applications, yet its deployment on real systems is still limited due to safety and operational constraints. The safe RL field has gained considerable attention in recent years, which focuses on imposing safety constraints throughout the learning process. However, real systems often require more complex constraints than just safety, such as periodic recharging or time-bounded visits to specific regions. Imposing such spatio-temporal tasks during learning still remains a challenge. Signal Temporal Logic (STL) is a formal language for specifying temporal properties of real-valued signals and provides a way to express such complex tasks. In this paper, the authors propose a framework that leverages sequential control barrier functions and model-free RL to ensure that the given STL tasks are satisfied throughout the learning process.","Alert: Tomlin. High - safe RL with temporal logic"
"LAR-MoE: Mixture of Experts for Imitation Learning","not specified","arXiv preprint","Jan 2026","https://arxiv.org/abs/2601.21971","2026-03-24","email","definitely","Imitation Learning","Mixture-of-experts architecture handles multi-modal imitation learning","Mixture-of-experts architecture for imitation learning.","A supervised Mixture-of-Experts (MoE) architecture is presented for phase-structured surgical manipulation tasks, which can be added on top of any autonomous policy. Unlike prior surgical robot learning approaches that rely on multi-camera setups or thousands of demonstrations, the approach shows improved efficiency in learning surgical tasks.","Alert: Majumdar. High - MoE for IL"
"In-Context Imitation Learning","not specified","arXiv preprint","Mar 2026","https://arxiv.org/abs/2603.07530","2026-03-24","email","definitely","Imitation Learning","Robots learn new tasks from demonstrations at inference time, no retraining","In-context learning paradigm applied to robot imitation learning.","In-context imitation learning enables robots to adapt to new tasks from a small number of demonstrations without additional training. However, existing approaches typically condition only on state-action trajectories and lack explicit representations of task intent. This limitation hinders performance in complex and ambiguous task settings where the same actions may be consistent with different objectives. To address this, the authors present In-Context Imitation Learning with Visual Reasoning (ICLR), a novel framework that augments demonstration prompts with structured visual reasoning traces representing anticipated future robot trajectories in image space. ICLR also jointly learns to generate reasoning traces and low-level actions within a unified autoregressive transformer, enabling the model to mimic not only action prediction but also the reasoning process that leads to those actions.","Alert: Majumdar. High - in-context IL"
"Squint: Fast Visual RL for Sim-to-Real Transfer","not specified","arXiv preprint","Feb 2026","https://arxiv.org/abs/2602.21203","2026-03-24","email","definitely","Reinforcement Learning","Visual RL achieves efficient sim-to-real transfer with minimal overhead","Fast visual RL for efficient sim-to-real transfer.","Squint is a fast off-policy visual actor critic method that achieves faster wall-clock training than prior visual RL methods. The method achieves efficiency through several technical contributions including parallel simulation, a distributional critic, resolution squinting, layer normalization, a tuned update-to-data ratio, and an optimized implementation. A distinctive aspect of the approach is its use of image downsampling: rendering at high resolution and then area downsampling to 16x16 (referred to as squinting), which provides natural anti-aliasing and preserves scene structure that aids sim-to-real transfer. The method was evaluated on the SO-101 Task Set, a new suite of eight manipulation tasks in ManiSkill3 with heavy domain randomization, and demonstrated sim-to-real transfer to a real SO-101 robot, with policies trained for 15 minutes on a single RTX 3090 GPU.","Alert: Majumdar. High - visual RL sim-to-real"
"Safe RL for Optimal Tracking Control","not specified","arXiv preprint","Feb 2026","https://arxiv.org/abs/2602.04132","2026-03-24","email","definitely","Safe RL","RL tracking controllers get safety guarantees during training and deployment","Safe RL for optimal tracking control with safety guarantees.","Reinforcement Learning (RL) has achieved remarkable success in solving complex sequential decision-making problems. However, its application to safety-critical physical systems remains constrained by the lack of stability guarantees. Standard RL algorithms prioritize reward maximization, often yielding policies that may induce oscillations or unbounded state divergence. There has been significant work in incorporating Lyapunov-based stability guarantees in RL algorithms with key challenges being selecting a candidate Lyapunov function, computational complexity by using excessive function approximators and conservative policies by incorporating stability criterion in the learning process. In this work, the authors propose a novel Lyapunov-constrained Soft Actor-Critic (LC-SAC) algorithm using Koopman operator theory.","Alert: Tomlin. High - safe RL for tracking"
"Lifelong Imitation Learning","not specified","arXiv preprint","Mar 2026","https://arxiv.org/abs/2603.10929","2026-03-24","email","definitely","Imitation Learning","Continual imitation learning avoids catastrophic forgetting across tasks","Continual/lifelong learning in imitation learning setting.","The paper introduces a lifelong imitation learning framework that enables continual policy refinement across sequential tasks under realistic memory and data constraints. The approach operates entirely in a multimodal latent space, where compact representations of visual, linguistic, and robot's state information are stored and reused to support future learning. To further stabilize adaptation, the authors introduce an incremental feature adjustment mechanism that regularizes the evolution of task embeddings through an angular margin constraint, preserving inter-task distinctiveness. The method establishes a new state of the art in the LIBERO benchmarks, achieving 10-17 point gains in AUC and up to 65% less forgetting compared to previous leading methods.","Alert: Majumdar. High - continual IL"
"ADMM-Based Distributed MPC with CBFs for Multi-Agent Systems","not specified","arXiv preprint","Mar 2026","https://arxiv.org/abs/2603.19170","2026-03-24","email","definitely","Safety & Verification","Distributed MPC + CBFs enable safe multi-agent coordination at scale","Distributed MPC with CBFs for multi-agent safety.","A fully decentralized model predictive control (MPC) framework with control barrier function (CBF) constraints for safety-critical trajectory planning in multi-robot legged systems has been proposed. The centralized safety-critical MPC problem is reformulated using a structured distributed optimization approach based on the alternating direction method of multipliers (ADMM), introducing a node-edge splitting technique with consensus constraints that decomposes the global problem into independent node-local and edge-local subproblems solvable in parallel using only neighbor-to-neighbor communication. This enables efficient real-time trajectory optimization with symmetric computational load across agents, while preserving safety and dynamic feasibility.","Alert: Lindemann/Tomlin. High - distributed safe control"
"Risk-Aware RL for Mobile Manipulation","not specified","arXiv preprint","Mar 2026","https://arxiv.org/abs/2603.04579","2026-03-24","email","definitely","Reinforcement Learning","Risk-sensitive RL produces safer mobile manipulation behaviors","Risk-aware RL for mobile manipulation tasks.","For robots to successfully transition from lab settings to everyday environments, they must reason about the risks associated with their actions and make informed, risk-aware decisions. This is particularly true for robots performing mobile manipulation tasks, which involve both interacting with and navigating within dynamic, unstructured spaces. However, existing whole-body controllers for mobile manipulators typically lack explicit mechanisms for risk-sensitive decision-making under uncertainty. The authors claim to be the first to learn risk-aware visuomotor policies for mobile manipulation conditioned on egocentric depth observations with runtime-adjustable risk sensitivity, and to show risk-aware behaviours can be transferred through Imitation Learning to a visuomotor policy conditioned on egocentric depth observations.","Alert: Majumdar. High - risk-aware RL"
