"title","authors","venue","publishing_date","url","date_found","source_mode","relevance_tier","theme_group","headline","summary","abstract","notes"
"RoboCopilot: Human-in-the-loop Interactive Imitation Learning for Robot Manipulation","Not specified","arXiv:2503.07771","Mar 2025","https://arxiv.org/abs/2503.07771","2026-03-30","web_survey","probably","Imitation Learning","Robot adopts copilot role before skill training enabling efficient bimanual imitation from human guidance","Interactive demonstration framework where robot adopts assistive copilot role before extensive bimanual skill training.","Learning from human demonstration is an effective approach for learning complex manipulation skills. However, existing approaches heavily focus on learning from passive human demonstration data for its simplicity in data collection. Interactive human teaching has appealing theoretical and practical properties, but they are not well supported by existing human-robot interfaces. This paper proposes a novel system that enables seamless control switching between human and an autonomous policy for bi-manual manipulation tasks, enabling more efficient learning of new tasks. This is achieved through a compliant, bilateral teleoperation system. The system adopts the algorithmic framework introduced by Human-Gated DAgger (HG-DAgger) for interactive imitation learning and adapts it to the manipulation setting. In this pipeline, they alternate between model training and data collection with a learned policy, where, during data collection, a human teleoperator interrupts and provides corrective feedback. This enables the robot to continually improve performance throughout the teaching process and collect higher-quality interactive data. The paper demonstrates the effectiveness of this approach through both simulation and hardware experiments on complex bi-manual manipulation tasks.","Probably: interactive IL for bimanual manipulation"
"Topological Obstructions to the Existence of Control Barrier Functions","Massimiliano de Sa, Aaron D. Ames","arXiv","Mar 2026","https://arxiv.org/abs/2603.18422","2026-03-31","email","definitely","Safety & Verification (CBF Theory)","Brockett-like topological conditions reveal when smooth CBFs provably cannot exist","The paper establishes topological necessary conditions for the existence of control barrier functions (CBFs), analogous to Brockett's classical obstruction conditions for asymptotic stabilizability. By exploiting the unique geometry of CBF safe sets, the authors derive simple, self-contained derivations that reveal fundamental topological constraints on CBF existence. The results encompass necessary conditions for safe sets homeomorphic to a closed ball and generalize prior work on set stabilization, potentially guiding practitioners away from safe set geometries where CBF-based controllers cannot exist.","In 1983, Brockett developed a topological necessary condition for the existence of continuous, asymptotically stabilizing control laws. Building upon recent work on necessary conditions for set stabilization, we develop Brockett-like necessary conditions for the existence of control barrier functions (CBFs). By leveraging the unique geometry of CBF safe sets, we provide simple and self-contained derivations of necessary conditions for the existence of CBFs and their safe, continuous controllers. We demonstrate the application of these conditions to instructive examples and kinematic nonholonomic systems, and discuss their relationship to Brockett's necessary condition.",""
"Integral Control Barrier Functions with Input Delay: Prediction, Feasibility, and Robustness","Adam K. Kiss, Ersin Das, Tamas G. Molnar, Aaron D. Ames","arXiv","Mar 2026","https://arxiv.org/abs/2603.24566","2026-03-31","email","definitely","Safety & Verification (CBF Theory)","Prediction-based integral CBFs handle input delay with safety and feasibility guarantees","Time delays in feedback loops can cause controllers to respond too late and apply excessively large corrections, causing safety violations and infeasibility. This paper extends integral CBF theory to nonlinear systems with input delay using predictor feedback, constructing a framework that handles both state constraint safety and input constraint feasibility simultaneously. The authors analyze robustness to model uncertainty and provide conditions ensuring the framework remains valid across a range of delay values.","Time delays in feedback control loops can cause controllers to respond too late, and with excessively large corrective actions, leading to unsafe behavior (violation of state constraints) and controller infeasibility (violation of input constraints). To address this problem, we develop a safety-critical control framework for nonlinear systems with input delay using dynamically defined (integral) controllers. Building on the concept of Integral Control Barrier Functions (ICBFs), we concurrently address two fundamental challenges: compensating the effect of delays, while ensuring feasibility when state and input constraints are imposed jointly. To this end, we embed predictor feedback into a dynamically defined control law to compensate for delays, with the predicted state evolving according to delay-free dynamics. Then, utilizing ICBFs, we formulate a quadratic program for safe control design. For systems subject to simultaneous state and input constraints, we derive a closed-form feasibility condition for the resulting controller, yielding a compatible ICBF pair that guarantees forward invariance under delay. We also address robustness to prediction errors (e.g., caused by delay uncertainty) using tunable robust ICBFs. Our approach is validated on an adaptive cruise control example with actuation delay.",""
"Enforcing Mixed State-Input Constraints with Multiple Backup Control Barrier Functions: A Projection-based Approach","Laszlo Gacsi, Adam K. Kiss, Ersin Das, Tamas G. Molnar","arXiv","Mar 2026","https://arxiv.org/abs/2603.17097","2026-03-31","email","definitely","Safety & Verification (CBF Theory)","Projection-based backup CBFs unify state, input, and mixed safety constraints in a single framework","Many real systems require satisfying constraints that couple both states and inputs (e.g., power constraints involving both velocity and force). This paper generalizes backup CBF theory to handle mixed state-input constraints through a projection-based approach using multiple backup barrier functions. The unified framework enforces state constraints, input constraints, and mixed constraints simultaneously, providing a principled safety-critical control design for systems with complex constraint structures.","Ensuring the safety of control systems often requires the satisfaction of constraints on states (such as position or velocity), control inputs (such as force), and a mixture of states and inputs (such as power that depends on both velocity and force). This paper presents a safety-critical control framework for enforcing mixed state-input constraints through a generalization of backup control barrier functions (backup CBFs). First, we extend the backup CBF approach to maintain multiple decoupled state and input constraints using a single backup set-backup controller pair. Second, we address mixed state-input constraints by converting them into state constraints using a projection from the state-input space to the state space along the backup controller. In the special case of decoupled state and input constraints, the proposed method simplifies the synthesis of backup CBFs by eliminating the need for saturating backup control laws. Finally, we demonstrate the efficacy of the proposed method on an inverted pendulum example, where constraints on the angle (state), torque (input), and power (mixture of state and input) are satisfied simultaneously.",""
"Contingency-Aware Planning via Certified Neural Hamilton-Jacobi Reachability","Kasidit Muenprasitivej, Derya Aksaray","arXiv","Mar 2026","https://arxiv.org/abs/2603.17022","2026-03-31","email","definitely","Safety & Verification (HJ Reachability)","Fourier Neural Operators accelerate HJ reachability enabling certified real-time contingency planning","Hamilton-Jacobi reachability provides formal safety guarantees but solving HJ PDEs is computationally prohibitive for high-dimensional systems. This paper employs a Fourier Neural Operator (FNO) to approximate the HJ-Isaacs solution operator, enabling certified reachability computation compatible with real-time planning rates. The resulting contingency-aware navigation framework integrates neural reachability certificates with sampling-based planning to handle unknown environments with multiple possible goals.","Hamilton-Jacobi (HJ) reachability provides formal safety guarantees for dynamical systems, but solving high-dimensional HJ partial differential equations limits its use in real-time planning. This paper presents a contingency-aware multi-goal navigation framework that integrates learning-based reachability with sampling-based planning in unknown environments. We use Fourier Neural Operator (FNO) to approximate the solution operator of the Hamilton-Jacobi-Isaacs variational inequality under varying obstacle configurations. We first provide a theoretical under-approximation guarantee on the safe backward reach-avoid set, which enables formal safety certification of the learned reachable sets. Then, we integrate the certified reachable sets with an incremental multi-goal planner, which enforces reachable-set constraints and a recovery policy that guarantees finite-time return to a safe region. Overall, we demonstrate that the proposed framework achieves asymptotically optimal navigation with provable contingency behavior, and validate its performance through real-time deployment on KUKA's youBot in Webots simulation.",""
"Constricting Tubes for Prescribed-Time Safe Control","Darshan Gadginmath, Ahmed Allibhoy, Fabio Pasqualetti","arXiv","Mar 2026","https://arxiv.org/abs/2603.17003","2026-03-31","email","definitely","Safety & Verification (CBF Theory)","Time-varying CBF tubes constrict to the safe set guaranteeing prescribed-time safe recovery","This paper introduces a constricting CBF framework for systems that start outside the desired safe set and must enter it by a specified deadline. A time-varying tube shrinks from a relaxed initial set containing the starting condition to the target safe set at the user-specified time, and any controller rendering the tube forward invariant achieves prescribed-time recovery by construction. The constriction schedule is bounded and tunable, and the framework integrates with standard CBF-based QP controllers.","We propose a constricting Control Barrier Function (CBF) framework for prescribed-time control of control-affine systems with input constraints. Given a system starting outside a target safe set, we construct a time-varying safety tube that shrinks from a relaxed set containing the initial condition to the target set at a user-specified deadline. Any controller rendering this tube forward invariant guarantees prescribed-time recovery by construction. The constriction schedule is bounded and tunable by design, in contrast to prescribed-time methods where control effort diverges near the deadline. Feasibility under input constraints reduces to a single verifiable condition on the constriction rate, yielding a closed-form minimum recovery time as a function of control authority and initial violation. The framework imposes a single affine constraint per timestep regardless of state dimension, scaling to settings where grid-based reachability methods are intractable. We validate on a 16-dimensional multi-agent system and a unicycle reach-avoid problem, demonstrating prescribed-time recovery with bounded control effort.",""
"Information-Driven Active Perception for k-step Predictive Safety Monitoring","Sumukha Udupa, Jie Fu","arXiv","Mar 2026","https://arxiv.org/abs/2603.23450","2026-03-31","email","definitely","Safety & Verification (Active Sensing)","Active sensor scheduling maximizes information gain for k-step predictive safety under budget constraints","This work studies active perception policy synthesis for predictive safety monitoring in partially observable stochastic systems operating under strict sensing and communication budgets. The system dynamics are modeled as a labeled HMM and safety requirements as a DFA, with the monitor dynamically scheduling sensor queries to maximize information gain about safety over a k-step horizon. The framework bridges information-theoretic active learning with formal safety verification, connecting to active data collection strategies relevant for safety-critical robotics.","This work studies the synthesis of active perception policies for predictive safety monitoring in partially observable stochastic systems. Operating under strict sensing and communication budgets, the proposed monitor dynamically schedules sensor queries to maximize information gain about the safety of future states. The underlying stochastic dynamics are captured by a labeled hidden Markov model (HMM), with safety requirements defined by a deterministic finite automaton (DFA). To enable active information acquisition, we introduce minimizing k-step Shannon conditional entropy of the safety of future states as a planning objective, under the constraint of a limited sensor query budget. Using observable operators, we derive an efficient algorithm to compute the k-step conditional entropy and analyze key properties of the conditional entropy gradient with respect to policy parameters. We validate the effectiveness of the method for predictive safety monitoring through a dynamic congestion game example.",""
"Elements of Conformal Prediction for Statisticians","Matteo Sesia, Stefano Favaro","arXiv","Mar 2026","https://arxiv.org/abs/2603.23923","2026-03-31","email","definitely","Conformal Prediction & Uncertainty","Statistical tutorial connecting conformal prediction theory to high-dimensional ML applications","This tutorial presents conformal prediction from a rigorous statistical perspective, addressing statisticians seeking formal foundations for distribution-free predictive inference. The paper covers coverage guarantees, efficiency properties, and the relationships between conformal methods and classical statistical frameworks. It serves as a bridge between the rapidly growing ML literature on conformal prediction and the statistical community, particularly relevant for researchers using conformal methods for safety and uncertainty quantification in robotics.","Predictive inference is a fundamental task in statistics, traditionally addressed using parametric assumptions about the data distribution and detailed analyses of how models learn from data. In recent years, conformal prediction has emerged as a rapidly growing alternative framework that is particularly well suited to modern applications involving high-dimensional data and complex machine learning models. Its appeal stems from being both distribution-free -- relying mainly on symmetry assumptions such as exchangeability -- and model-agnostic, treating the learning algorithm as a black box. Even under such limited assumptions, conformal prediction provides exact finite-sample guarantees, though these are typically of a marginal nature that requires careful interpretation. This paper explains the core ideas of conformal prediction and reviews selected methods. Rather than offering an exhaustive survey, it aims to provide a clear conceptual entry point and a pedagogical overview of the field.",""
"Flow Matching Policy with Entropy Regularization","Ting Gao, Stavros Orfanoudakis, Nan Lin, Elvin Isufi, Winnie Daamen, Serge Hoogendoorn","arXiv","Mar 2026","https://arxiv.org/abs/2603.17685","2026-03-31","email","definitely","Flow Matching & Diffusion Policies","Entropy-regularized flow matching gives tractable policy gradients overcoming SDE-based diffusion limits in RL","SDE-based diffusion policies in RL suffer from intractable entropy computation and expensive policy gradients through iterative denoising chains. This paper proposes a flow matching policy formulation that incorporates direct entropy regularization, enabling tractable exact entropy control without the denoising bottleneck. The result is a computationally efficient generative policy class with principled exploration for reinforcement learning, combining the representational power of flow models with practical RL training.","Diffusion-based policies have gained significant popularity in Reinforcement Learning (RL) due to their ability to represent complex, non-Gaussian distributions. Stochastic Differential Equation (SDE)-based diffusion policies often rely on indirect entropy control due to the intractability of the exact entropy, while also suffering from computationally prohibitive policy gradients through the iterative denoising chain. To overcome these issues, we propose Flow Matching Policy with Entropy Regularization (FMER), an Ordinary Differential Equation (ODE)-based online RL framework. FMER parameterizes the policy via flow matching and samples actions along a straight probability path, motivated by optimal transport. FMER leverages the model's generative nature to construct an advantage-weighted target velocity field from a candidate set, steering policy updates toward high-value regions. By deriving a tractable entropy objective, FMER enables principled maximum-entropy optimization for enhanced exploration. Experiments on sparse multi-goal FrankaKitchen benchmarks demonstrate that FMER outperforms state-of-the-art methods, while remaining competitive on standard MuJoco benchmarks. Moreover, FMER reduces training time by 7x compared to heavy diffusion baselines (QVPO) and 10-15% relative to efficient variants.",""
"Safety Guarantees for Neural Network-Encoded Control Policies Through Constrained Reinforcement Learning","H Entenmann et al.","IEEE Robotics and Automation Letters","2026","https://ieeexplore.ieee.org/document/11430591","2026-03-31","email","definitely","Safety & Verification (Neural Controllers)","Constrained RL training embeds CBF-based safety guarantees directly into neural network policies","This paper proposes a constrained reinforcement learning framework for training neural network controllers that satisfy formal safety guarantees encoded via control barrier functions. Safety constraints are integrated directly into the RL training objective, ensuring that the learned neural policy satisfies CBF-based conditions throughout training. The approach provides a principled connection between data-driven RL policy training and the formal verification of safety properties for neural controllers, appearing in IEEE RA-L.","Neural network-based control policies offer flexibility but lack formal safety guarantees. This work proposes training such policies via constrained reinforcement learning using control barrier function conditions as explicit constraints, so that the resulting neural policy provably satisfies safety specifications. The framework is validated on robotic control tasks, demonstrating that safety guarantees can be embedded into learned policies without sacrificing task performance.",""
"Beyond Imitation: Reinforcement Learning Fine-Tuning for Adaptive Diffusion Navigation Policies","Junhe Sheng, Ruofei Bai, Kuan Xu, Ruimeng Liu, Jie Chen, Shenghai Yuan, Wei-Yun Yau, Lihua Xie","arXiv","Mar 2026","https://arxiv.org/abs/2603.12868","2026-03-31","email","probably","Flow Matching & Diffusion Policies","RL fine-tuning closes distribution shift gap for diffusion navigation policies in unseen environments","Diffusion-based navigation policies trained on large offline datasets generalize well zero-shot but fail in unseen environments due to distribution shift causing accumulated trajectory errors. This work proposes RL fine-tuning as a post-hoc adaptation strategy that preserves the multi-modal trajectory generation capability of diffusion policies while using online reward feedback to adapt behavior to novel settings. The approach addresses safety-critical failures caused by deployment-time distribution shift without retraining from scratch.","Diffusion-based robot navigation policies trained on large-scale imitation learning datasets, can generate multi-modal trajectories directly from the robot's visual observations, bypassing the traditional localization-mapping-planning pipeline and achieving strong zero-shot generalization. However, their performance remains constrained by the coverage of offline datasets, and when deployed in unseen settings, distribution shift often leads to accumulated trajectory errors and safety-critical failures. Adapting diffusion policies with reinforcement learning is challenging because their iterative denoising structure hinders effective gradient backpropagation, while also making the training of an additional value network computationally expensive and less stable. To address these issues, we propose a reinforcement learning fine-tuning framework tailored for diffusion-based navigation. The method leverages the inherent multi-trajectory sampling mechanism of diffusion models and adopts Group Relative Policy Optimization (GRPO), which estimates relative advantages across sampled trajectories without requiring a separate value network. To preserve pretrained representations while enabling adaptation, we freeze the visual encoder and selectively update the higher decoder layers and action head, enhancing safety-aware behaviors through online environmental feedback. On the PointGoal task in Isaac Sim, our approach improves the Success Rate from 52.0% to 58.7% and SPL from 0.49 to 0.54 on unseen scenes, while reducing collision frequency. Additional experiments show that the fine-tuned policy transfers zero-shot to a real quadruped platform and maintains stable performance in geometrically out-of-distribution environments, suggesting improved adaptability and safe generalization to new domains.",""
"REFINE-DP: Diffusion Policy Fine-tuning for Humanoid Loco-manipulation via Reinforcement Learning","Zhaoyuan Gu, Yipu Chen, Zimeng Chai, Alfred Cueva, Thong Nguyen, Yifan Wu, Huishu Xue, Minji Kim, Isaac Legene, Fukang Liu, Matthew Kim, Ayan Barula, Yongxin Chen, Ye Zhao","arXiv","Mar 2026","https://arxiv.org/abs/2603.13707","2026-03-31","email","probably","Flow Matching & Diffusion Policies","RL refines diffusion policies for humanoid loco-manipulation bridging motion planning and execution gap","Diffusion policies show promise for humanoid loco-manipulation but offline-trained planners decouple from low-level controllers, causing distribution shift and task failures. REFINE-DP fine-tunes pre-trained diffusion policies with RL to couple the motion planner and whole-body controller, reducing distribution shift and improving command tracking. The framework demonstrates improved success rates on complex long-horizon humanoid tasks requiring coordinated locomotion and manipulation.","Humanoid loco-manipulation requires coordinated high-level motion plans with stable, low-level whole-body execution under complex robot-environment dynamics and long-horizon tasks. While diffusion policies (DPs) show promise for learning from demonstrations, deploying them on humanoids poses critical challenges: the motion planner trained offline is decoupled from the low-level controller, leading to poor command tracking, compounding distribution shift, and task failures. The common approach of scaling demonstration data is prohibitively expensive for high-dimensional humanoid systems. To address this challenge, we present REFINE-DP (REinforcement learning FINE-tuning of Diffusion Policy), a hierarchical framework that jointly optimizes a DP high-level planner and an RL-based low-level loco-manipulation controller. The DP is fine-tuned via a PPO-based diffusion policy gradient to improve task success rate, while the controller is simultaneously updated to accurately track the planner's evolving command distribution, reducing the distributional mismatch that degrades motion quality. We validate REFINE-DP on a humanoid robot performing loco-manipulation tasks, including door traversal and long-horizon object transport. REFINE-DP achieves an over $90\%$ success rate in simulation, even in out-of-distribution cases not seen in the pre-trained data, and enables smooth autonomous task execution in real-world dynamic environments. Our proposed method substantially outperforms pre-trained DP baselines and demonstrates that RL fine-tuning is key to reliable humanoid loco-manipulation. https://refine-dp.github.io/REFINE-DP/",""
